<?xml version="1.0" encoding="UTF-8"?>

<!-- grupo 13 -->
<registro periodo="2012-03" xmlns:xsi="http://www.w3.org/2001/XMLSchema-instance" xsi:noNamespaceSchemaLocation="registrofacturasgrupo13.xsd">
  <responsable>Lic. Inocencio Pérez</responsable>
  
  <factura tipo="final">
    <num>564</num>
    <cliente codigo="001" sexo="femenino">
      <nombre>María Vélez</nombre>
      <documento>
        <dui vence="2018-03-03">02349867-9</dui>
      </documento>
      <telefonos>
        <telfcasa >22252222</telfcasa>
      </telefonos>
      <email>mariav@gmail.com</email>
    </cliente>
    <direccion depto="San Salvador" municipio="San Salvador">
      <casa>Prados del Bosque Num.23</casa>
    </direccion>
    <lineafactura factura="564">
      <codigo tipo="souvenir">498</codigo>
      <detalle>Llavero estampas de mi pueblo: Izalco</detalle>
      <cantidad>10</cantidad>
      <precio>
        <moneda>$</moneda>
        <valor>1.13</valor>
      </precio>
      <subtotal>
        <moneda>$</moneda>
        <valor>11.30</valor>
      </subtotal>
    </lineafactura>
    <total>
      <moneda>$</moneda>
      <valor>11.30</valor>
    </total>
  </factura>
  
  <factura tipo="credito">
    <num>570</num>
    <cliente codigo="002" sexo="femenino">
      <nombre>Julia Pérez</nombre>
      <documento>
        <pasaporte pais="USA">A98672340</pasaporte>
      </documento>
      <telefonos>
        <telfcelular agencia="movistar">78757471</telfcelular>
      </telefonos>
      <email>jperez@sica.com</email>
    </cliente>
    <direccion depto="La Libertad" municipio="Antiguo Cuscatlan">
      <oficina>5 Av. Sur</oficina>
    </direccion>
    <lineafactura factura="570">
      <codigo tipo="pcportatiles">734</codigo>
      <detalle>netbook acer a240</detalle>
      <cantidad>3</cantidad>
      <precio>
        <moneda>$</moneda>
        <valor>350.00</valor>
      </precio>
      <subtotal>
        <moneda>$</moneda>
        <valor>1050.00</valor>
      </subtotal>
    </lineafactura>
    <total>
      <moneda>$</moneda>
      <valor>1050.00</valor>
    </total>
  </factura>
  
  <factura tipo="credito">
    <num>575</num>
    <cliente codigo="003" sexo="masculino">
      <nombre>Jhon Smith</nombre>
      <documento>
        <pasaporte pais="USA">A98670234</pasaporte>
      </documento>
      <telefonos>
        <telfcasa>21202222</telfcasa>
      </telefonos>
    <email>jsmith@usaid.com</email>
    </cliente>
    <direccion depto="La Libertad" municipio="Santa Tecla">
      <oficina>Final 25 Av. Norte</oficina>
    </direccion>
    <lineafactura factura="575">
      <codigo tipo="accesorio_pc">247</codigo>
      <detalle>Mouse inalámbrico</detalle>
      <cantidad>5</cantidad>
      <precio>
        <moneda>$</moneda>
        <valor>10.00</valor>
      </precio>
      <subtotal>
        <moneda>$</moneda>
        <valor>50.00</valor>
      </subtotal>
    </lineafactura>
    <total>
      <moneda>$</moneda>
      <valor>50.00</valor>
    </total>
  </factura>
  
  <factura tipo="final">
    <num>590</num>
    <cliente codigo="004" sexo="masculino">
      <nombre>Juan Pérez</nombre>
      <documento>
        <pasaporte pais="SLV">A40298367</pasaporte>
      </documento>
      <telefonos>
        <telfcasa >20212223</telfcasa>
      </telefonos>
      <email>jperez@gmail.com</email>
    </cliente>
    <lineafactura factura="590">
      <codigo tipo="perecedero">213</codigo>
      <detalle>Agua embotellada</detalle>
      <cantidad>10</cantidad>
      <precio>
        <moneda>$</moneda>
        <valor>0.50</valor>
      </precio>
      <subtotal>
        <moneda>$</moneda>
        <valor>5.00</valor>
      </subtotal>
    </lineafactura>
    <total>
      <moneda>$</moneda>
      <valor>5.00</valor>
    </total>
  </factura>
  
  <factura tipo="final">
    <num>593</num>
    <cliente codigo="005" sexo="masculino">
      <nombre>Pedro Portillo</nombre>
      <documento>
       <pasaporte pais="SLV">A43698027</pasaporte>
      </documento>
      <telefonos>
        <telfcasa >24252627</telfcasa>
      </telefonos>
      <email>pportillo@hotmail.com</email>
    </cliente>
    <lineafactura factura="593">
      <codigo tipo="perecedero">215</codigo>
      <detalle>Soda enlatada</detalle>
      <cantidad>24</cantidad>
      <precio>
        <moneda>$</moneda>
        <valor>0.50</valor>
      </precio>
      <subtotal>
        <moneda>$</moneda>
        <valor>5.00</valor>
      </subtotal>
    </lineafactura>
    <total>
      <moneda>$</moneda>
      <valor>5.00</valor>
    </total>
  </factura>
  
  <factura tipo="credito">
    <num>585</num>
    <cliente codigo="006" sexo="masculino">
      <nombre>Jhon Smith</nombre>
      <documento>
        <dui vence="2018-06-03">02810867-0</dui>
      </documento>
      <telefonos>
        <telfcasa >25262728</telfcasa>
      </telefonos>
      <email>jsmith@usaid.com</email>
    </cliente>
    <direccion depto="La Libertad" municipio="Santa Tecla">
      <oficina>Final 25 Av. Norte</oficina>
    </direccion>
    <lineafactura factura="575">
      <codigo tipo="accesorio_pc">247</codigo>
      <detalle>Mouse inalámbrico</detalle>
      <cantidad>10</cantidad>
      <precio>
        <moneda>$</moneda>
        <valor>10.00</valor>
      </precio>
      <subtotal>
        <moneda>$</moneda>
        <valor>100.00</valor>
      </subtotal>
    </lineafactura>
    <total>
      <moneda>$</moneda>
      <valor>100.00</valor>
    </total>
  </factura>
  
  <factura tipo="final">
    <num>501</num>
    <cliente codigo="007" sexo="femenino">
      <nombre>Marta Alicia</nombre>
      <documento>
        <pasaporte pais="SLV">B40292519</pasaporte>
      </documento>
      <telefonos>
        <telfcelular agencia="tigo">71757471</telfcelular>
      </telefonos>
      <email>marticia@yahoo.com</email>
    </cliente>
    <direccion depto="Ahuachapán" municipio="Apaneca">
      <oficina>Av. 15 de Abril Norte</oficina>
    </direccion>
    <lineafactura factura="501">
      <codigo tipo="perecedero">319</codigo>
      <detalle>Pastelito de chocolate</detalle>
      <cantidad>5</cantidad>
      <precio>
        <moneda>$</moneda>
        <valor>0.35</valor>
      </precio>
      <subtotal>
        <moneda>$</moneda>
        <valor>1.75</valor>
      </subtotal>
    </lineafactura>
    <total>
      <moneda>$</moneda>
      <valor>1.75</valor>
    </total>
  </factura>

  <factura tipo="final">
    <num>469</num>
    <cliente codigo="008" sexo="masculino">
      <nombre>Marco Florencio</nombre>
      <documento>
        <dui vence="2028-09-13">02813717-0</dui>
      </documento>
      <telefonos>
        <telfcelular agencia="claro">79754471</telfcelular>
      </telefonos>
      <email>mflowren@outlook.com</email>
    </cliente>
    <lineafactura factura="469">
      <codigo tipo="pcescritorio">798</codigo>
      <detalle>Lenovo m700sff</detalle>
      <cantidad>3</cantidad>
      <precio>
        <moneda>$</moneda>
        <valor>400.00</valor>
      </precio>
      <subtotal>
        <moneda>$</moneda>
        <valor>1200.00</valor>
      </subtotal>
    </lineafactura>
    <total>
      <moneda>$</moneda>
      <valor>1200.00</valor>
    </total>
  </factura>

  <factura tipo="credito">
    <num>618</num>
    <cliente codigo="009" sexo="masculino">
      <nombre>Samuel Herrón</nombre>
      <documento>
        <pasaporte pais="USA">U99125581</pasaporte>
      </documento>
      <telefonos>
        <telfcelular agencia="movistar">61757471</telfcelular>
      </telefonos>
      <email>serronel@oracle.com</email>
    </cliente>
    <direccion depto="Chalatenango" municipio="Agua Caliente">
      <oficina>Calle Tránsito Aguilar</oficina>
    </direccion>
    <lineafactura factura="618">
      <codigo tipo="monitores">988</codigo>
      <detalle>ASUS TUF Gaming VG32AQL1A</detalle>
      <cantidad>1</cantidad>
      <precio>
        <moneda>$</moneda>
        <valor>500.00</valor>
      </precio>
      <subtotal>
        <moneda>$</moneda>
        <valor>500.00</valor>
      </subtotal>
    </lineafactura>
    <total>
      <moneda>$</moneda>
      <valor>500.00</valor>
    </total>
  </factura>

  <factura tipo="credito">
    <num>672</num>
    <cliente codigo="100" sexo="femenino">
      <nombre>Maria Mendoza</nombre>
      <documento>
        <dui vence="2030-12-29">15582763-6</dui>
      </documento>
      <telefonos>
        <telfcelular agencia="digicel">73217471</telfcelular>
      </telefonos>
      <email>maridoza@outlook.com</email>
    </cliente>
    <lineafactura factura="672">
      <codigo tipo="accesorio_pc">165</codigo>
      <detalle>Audifonos SONY</detalle>
      <cantidad>2</cantidad>
      <precio>
        <moneda>$</moneda>
        <valor>25.00</valor>
      </precio>
      <subtotal>
        <moneda>$</moneda>
        <valor>50.00</valor>
      </subtotal>
    </lineafactura>
    <total>
      <moneda>$</moneda>
      <valor>50.00</valor>
    </total>
  </factura>
</registro>